Entity,Relationship,Value
Suspicious bone marrow morphology for MPN (Finding) (Myeloproliferative_Neoplasm_A_Diagnostic_Approach_to_Bone_Marrow_Evaluation),requires,MPNR test (Diagnostic Procedure)
Not suspicious bone marrow morphology for MPN (Finding) (Myeloproliferative_Neoplasm_A_Diagnostic_Approach_to_Bone_Marrow_Evaluation),leads to,Erythrocytosis evaluation (Diagnostic Procedure)
Erythrocytosis evaluation (Diagnostic Procedure) (Myeloproliferative_Neoplasm_A_Diagnostic_Approach_to_Bone_Marrow_Evaluation),requires rule out,"Polycythemia vera, Primary myelofibrosis, Post-ET/PV myelofibrosis, MPN-unclassified (Disease or Syndrome)"
Erythrocytosis evaluation (Diagnostic Procedure) (Myeloproliferative_Neoplasm_A_Diagnostic_Approach_to_Bone_Marrow_Evaluation),requires,PV/AK test (Diagnostic Procedure)
Erythrocytosis evaluation (Diagnostic Procedure) (Myeloproliferative_Neoplasm_A_Diagnostic_Approach_to_Bone_Marrow_Evaluation),requires,MPNR test (Diagnostic Procedure)
PV/AK positive result (Finding) (Myeloproliferative_Neoplasm_A_Diagnostic_Approach_to_Bone_Marrow_Evaluation),suggests,Polycythemia vera (Disease or Syndrome)
PV/AK negative result (Finding) (Myeloproliferative_Neoplasm_A_Diagnostic_Approach_to_Bone_Marrow_Evaluation),requires,REVEZ test (Diagnostic Procedure)
PV/AK negative result (Finding) (Myeloproliferative_Neoplasm_A_Diagnostic_Approach_to_Bone_Marrow_Evaluation),consider,NHEP test (Diagnostic Procedure)
Gilbert or Crigler-Najjar syndromes type I or type II (Disease or Syndrome) (UGT1A1_Test-Ordering_Algorithm),requires,UGT1A1 promoter TA repeat polymorphisms and *6 allele analysis (Gene or Genome)
UGT1A1 promoter TA repeat polymorphisms and *6 allele analysis (Gene or Genome) (UGT1A1_Test-Ordering_Algorithm),is performed by,U1A1Q / UDP-Glucuronosyltransferase 1A1 TA Repeat Genotype (Diagnostic Procedure)
Carrier screening for Gilbert or Crigler-Najjar syndromes type I or type II (Diagnostic Procedure) (UGT1A1_Test-Ordering_Algorithm),requires,UGT1A1 full gene sequence analysis (Gene or Genome)
UGT1A1 full gene sequence analysis (Gene or Genome) (UGT1A1_Test-Ordering_Algorithm),is performed by,UGTFZ / UDP-Glucuronosyltransferase 1A1 Full Gene Sequencing (Diagnostic Procedure)
Drug metabolism assessment for drug toxicity (Diagnostic Procedure) (UGT1A1_Test-Ordering_Algorithm),requires,UGT1A1 full gene sequence analysis (Gene or Genome)
Possible Zika virus exposure (Finding) (Zika_Pregnant),requires screening for,Pregnancy (Finding)
Pregnancy (Finding) (Zika_Pregnant),requires evaluation of,Zika virus signs or symptoms (Finding)
Non-pregnant status (Finding) (Zika_Pregnant),excludes routine,Zika virus testing (Diagnostic Procedure)
Non-pregnant status (Finding) (Zika_Pregnant),indicates possible,Dengue virus testing (Diagnostic Procedure)
Symptomatic status ≤12 weeks (Finding) (Zika_Pregnant),requires,Zika virus rRT-PCR (Diagnostic Procedure)
Symptomatic status ≤12 weeks (Finding) (Zika_Pregnant),requires,Dengue virus testing (Diagnostic Procedure)
Positive Zika virus rRT-PCR (Finding) (Zika_Pregnant),indicates,Acute Zika infection (Disease or Syndrome)
Negative Zika rRT-PCR and negative Zika IgM (Finding) (Zika_Pregnant),rules out,Zika virus infection (Disease or Syndrome)
Positive dengue IgM/NS1 antigen/PCR (Finding) (Zika_Pregnant),indicates,Recent dengue virus infection (Disease or Syndrome)
Negative dengue IgM/NS1 antigen/PCR (Finding) (Zika_Pregnant),rules out,Dengue virus infection (Disease or Syndrome)
Asymptomatic travelers returning from Zika-endemic areas (Finding) (Zika_Pregnant),does not routinely require,Zika virus testing (Diagnostic Procedure)
Asymptomatic travelers returning from Zika-endemic areas (Finding) (Zika_Pregnant),may consider,Zika virus rRT-PCR (Diagnostic Procedure)
Clinical suspicion of myeloproliferative neoplasm (Disease or Syndrome) (Myeloproliferative_Neoplasm_A_Diagnostic_Approach_to_Peripheral_Blood_Evaluation),requires,CBC (Diagnostic Procedure)
Clinical suspicion of myeloproliferative neoplasm (Disease or Syndrome) (Myeloproliferative_Neoplasm_A_Diagnostic_Approach_to_Peripheral_Blood_Evaluation),requires,Peripheral blood smear (Diagnostic Procedure)
Clinical suspicion of myeloproliferative neoplasm (Disease or Syndrome) (Myeloproliferative_Neoplasm_A_Diagnostic_Approach_to_Peripheral_Blood_Evaluation),requires,BCR/ABL1 test (Diagnostic Procedure)
Positive BCR/ABL1 result (Finding) (Myeloproliferative_Neoplasm_A_Diagnostic_Approach_to_Peripheral_Blood_Evaluation),initiates,Chronic Myeloid Leukemia Algorithm (Diagnostic Procedure)
Negative BCR/ABL1 result (Finding) (Myeloproliferative_Neoplasm_A_Diagnostic_Approach_to_Peripheral_Blood_Evaluation),supports,Suspicion for polycythemia vera (Disease or Syndrome)
Suspicion for polycythemia vera (Disease or Syndrome) (Myeloproliferative_Neoplasm_A_Diagnostic_Approach_to_Peripheral_Blood_Evaluation),leads to,JAK2 V617F with reflex to JAK2 Exon 12-15 test (Diagnostic Procedure)
Positive JAK2 result (Finding) (Myeloproliferative_Neoplasm_A_Diagnostic_Approach_to_Peripheral_Blood_Evaluation),confirms,Polycythemia vera (Disease or Syndrome)
Negative JAK2 result (Finding) (Myeloproliferative_Neoplasm_A_Diagnostic_Approach_to_Peripheral_Blood_Evaluation),supports,Clinical suspicion for MPN (Disease or Syndrome)
High suspicion for MPN (Disease or Syndrome) (Myeloproliferative_Neoplasm_A_Diagnostic_Approach_to_Peripheral_Blood_Evaluation),requires,CALR with reflex to MPL test (Diagnostic Procedure)
Low suspicion for MPN (Disease or Syndrome) (Myeloproliferative_Neoplasm_A_Diagnostic_Approach_to_Peripheral_Blood_Evaluation),requires,Erythrocytosis evaluation test (Diagnostic Procedure)
No suspicion for polycythemia vera (Disease or Syndrome) (Myeloproliferative_Neoplasm_A_Diagnostic_Approach_to_Peripheral_Blood_Evaluation),leads to,JAK2 V617F with reflex to CALR and MPL test (Diagnostic Procedure)
Positive JAK2/CALR/MPL result (Finding) (Myeloproliferative_Neoplasm_A_Diagnostic_Approach_to_Peripheral_Blood_Evaluation),requires,Bone marrow study (Diagnostic Procedure)
Negative JAK2/CALR/MPL result (Finding) (Myeloproliferative_Neoplasm_A_Diagnostic_Approach_to_Peripheral_Blood_Evaluation),supports,Clinical suspicion for MPN (Disease or Syndrome)
High suspicion for MPN (Disease or Syndrome) (Myeloproliferative_Neoplasm_A_Diagnostic_Approach_to_Peripheral_Blood_Evaluation),requires,Bone marrow study (Diagnostic Procedure)
Low suspicion for MPN (Disease or Syndrome) (Myeloproliferative_Neoplasm_A_Diagnostic_Approach_to_Peripheral_Blood_Evaluation),leads to,No further testing (Procedure)
Initial newborn screen (Diagnostic Procedure) (Newborn_Screen_Follow-up_for_Mucopolysaccharidosis_Type_II),detects,Decreased iduronate-2-sulfatase activity (Finding)
Initial newborn screen (Diagnostic Procedure) (Newborn_Screen_Follow-up_for_Mucopolysaccharidosis_Type_II),detects,Elevated dermatan and heparan sulfate (Finding)
Abnormal newborn screen (Finding) (Newborn_Screen_Follow-up_for_Mucopolysaccharidosis_Type_II),prompts,"Iduronate-2-Sulfatase, Leukocytes test (Diagnostic Procedure)"
Abnormal newborn screen (Finding) (Newborn_Screen_Follow-up_for_Mucopolysaccharidosis_Type_II),prompts,"Mucopolysaccharidosis, Blood Spot test (Diagnostic Procedure)"
Abnormal newborn screen (Finding) (Newborn_Screen_Follow-up_for_Mucopolysaccharidosis_Type_II),prompts,"Mucopolysaccharides Quantitative, Random, Urine test (Diagnostic Procedure)"
Results consistent with MPS II (Finding) (Newborn_Screen_Follow-up_for_Mucopolysaccharidosis_Type_II),require,"Hunter Syndrome, Full Gene Analysis (Diagnostic Procedure)"
"Positive Hunter Syndrome, Full Gene Analysis result (Finding) (Newborn_Screen_Follow-up_for_Mucopolysaccharidosis_Type_II)",necessitates,Referral to Genetics Specialist (Therapeutic or Preventive Procedure)
"Negative Hunter Syndrome, Full Gene Analysis result (Finding) (Newborn_Screen_Follow-up_for_Mucopolysaccharidosis_Type_II)",necessitates,"Multiple Sulfatase Deficiency, Leukocytes test (Diagnostic Procedure)"
"Negative Hunter Syndrome, Full Gene Analysis result (Finding) (Newborn_Screen_Follow-up_for_Mucopolysaccharidosis_Type_II)",necessitates,"Arylsulfatase A Deficiency, Leukocytes test (Diagnostic Procedure)"
"Negative Hunter Syndrome, Full Gene Analysis result (Finding) (Newborn_Screen_Follow-up_for_Mucopolysaccharidosis_Type_II)",necessitates,"Ceramidase Trihexosides and Sulfatides, Random, Urine test (Diagnostic Procedure)"
"Negative Hunter Syndrome, Full Gene Analysis result (Finding) (Newborn_Screen_Follow-up_for_Mucopolysaccharidosis_Type_II)",implies,False-positive newborn screen (Finding)
Elevated lysophosphatidylcholines (Finding) (Newborn_Screen_Follow-up_for_X-Linked_Adrenoleukodystrophy),prompts,"Fatty Acid Profile, Peroxisomal (Diagnostic Procedure)"
Elevated very long chain fatty acids (Finding) (Newborn_Screen_Follow-up_for_X-Linked_Adrenoleukodystrophy),prompts,ABCD1 Gene Panel (Diagnostic Procedure)
Disease-causing ABCD1 variant (Finding) (Newborn_Screen_Follow-up_for_X-Linked_Adrenoleukodystrophy),confirms,X-linked adrenoleukodystrophy (Disease or Syndrome)
No disease-causing ABCD1 variant (Finding) (Newborn_Screen_Follow-up_for_X-Linked_Adrenoleukodystrophy),triggers,"Plasmalogens, Blood (Diagnostic Procedure)"
No disease-causing ABCD1 variant (Finding) (Newborn_Screen_Follow-up_for_X-Linked_Adrenoleukodystrophy),triggers,"Plasmalogens, Blood Spot (Diagnostic Procedure)"
No disease-causing ABCD1 variant (Finding) (Newborn_Screen_Follow-up_for_X-Linked_Adrenoleukodystrophy),triggers,"Bile Acids for Peroxisomal Disorders, Serum (Diagnostic Procedure)"
No disease-causing ABCD1 variant (Finding) (Newborn_Screen_Follow-up_for_X-Linked_Adrenoleukodystrophy),considers,Peroxisomal Disorder Gene Panel (Diagnostic Procedure)
Normal very long chain fatty acids (Finding) (Newborn_Screen_Follow-up_for_X-Linked_Adrenoleukodystrophy),if male excludes,X-linked adrenoleukodystrophy (Disease or Syndrome)
Normal very long chain fatty acids (Finding) (Newborn_Screen_Follow-up_for_X-Linked_Adrenoleukodystrophy),if female considers,ABCD1 Gene Panel (Diagnostic Procedure)
Aminolevulinic acid synthase (Enzyme) (The_Heme_Biosynthetic_Pathway),is induced by,"drugs, chemicals, or hormones (Pharmacologic Substance)"
Aminolevulinic acid synthase (Enzyme) (The_Heme_Biosynthetic_Pathway),requires cofactor,pyridoxal 5'-phosphate (Chemical)
Deficiency of Aminolevulinic acid dehydratase (Finding) (The_Heme_Biosynthetic_Pathway),causes,Aminolevulinic acid dehydratase deficiency (ADP) (Disease or Syndrome)
Deficiency of Porphobilinogen deaminase (Finding) (The_Heme_Biosynthetic_Pathway),causes,Acute intermittent porphyria (AIP) (Disease or Syndrome)
Deficiency of Uroporphyrinogen III cosynthase (Finding) (The_Heme_Biosynthetic_Pathway),causes,Congenital erythropoietic porphyria (CEP) (Disease or Syndrome)
Deficiency of Uroporphyrinogen decarboxylase (Finding) (The_Heme_Biosynthetic_Pathway),causes,Porphyria cutanea tarda (PCT) (Disease or Syndrome)
Deficiency of Coproporphyrinogen oxidase (Finding) (The_Heme_Biosynthetic_Pathway),causes,Hereditary coproporphyria (HCP) (Disease or Syndrome)
Deficiency of Protoporphyrinogen oxidase (Finding) (The_Heme_Biosynthetic_Pathway),causes,Variegate porphyria (VP) (Disease or Syndrome)
Deficiency of Ferrochelatase (Finding) (The_Heme_Biosynthetic_Pathway),causes,Erythropoietic protoporphyria (EPP) (Disease or Syndrome)
All individuals aged 18 to 79 years (Population Group) (Testing_Algorithm_for_the_Screening_and_Diagnosis_of_Hepatitis_C),requires screening with,HCV Antibody Screen with reflex to HCV RNA (Diagnostic Procedure)
Reactive HCV antibody (Finding) (Testing_Algorithm_for_the_Screening_and_Diagnosis_of_Hepatitis_C),reflexes to,HCV RNA test (Diagnostic Procedure)
Positive HCV RNA test (Finding) (Testing_Algorithm_for_the_Screening_and_Diagnosis_of_Hepatitis_C),indicates,Active HCV infection (Disease or Syndrome)
Active HCV infection (Disease or Syndrome) (Testing_Algorithm_for_the_Screening_and_Diagnosis_of_Hepatitis_C),requires,Direct Antiviral Agent Combination (Therapeutic or Preventive Procedure)
Negative HCV RNA test (Finding) (Testing_Algorithm_for_the_Screening_and_Diagnosis_of_Hepatitis_C),requires repeat testing if abnormal liver enzyme levels persist,HCV RNA test in 1 to 2 months (Diagnostic Procedure)
Negative HCV RNA test (Finding) (Testing_Algorithm_for_the_Screening_and_Diagnosis_of_Hepatitis_C),may warrant,HCV Antibody Confirmation (Diagnostic Procedure)
Positive HCV Antibody Confirmation (Finding) (Testing_Algorithm_for_the_Screening_and_Diagnosis_of_Hepatitis_C),indicates,Past/resolved HCV infection (Disease or Syndrome)
Negative HCV Antibody Confirmation (Finding) (Testing_Algorithm_for_the_Screening_and_Diagnosis_of_Hepatitis_C),indicates,False-reactive HCV antibody (Finding)
Negative HCV antibody (Finding) (Testing_Algorithm_for_the_Screening_and_Diagnosis_of_Hepatitis_C),requires if suspect acute hepatitis C or immunocompromised,HCV RNA test (Diagnostic Procedure)
Immunocompromised status (Finding) (Testing_Algorithm_for_the_Screening_and_Diagnosis_of_Hepatitis_C),requires,HCV RNA Qualitative and Quantitative test (Diagnostic Procedure)
Positive HCV RNA in immunocompromised status (Finding) (Testing_Algorithm_for_the_Screening_and_Diagnosis_of_Hepatitis_C),indicates,Active HCV infection (Disease or Syndrome)
No HCV RNA in immunocompromised status (Finding) (Testing_Algorithm_for_the_Screening_and_Diagnosis_of_Hepatitis_C),requires repeat testing if risk factors persist,HCV RNA test in 1 to 2 months (Diagnostic Procedure)
Hemolyzed or cadaveric serum screening test (Diagnostic Procedure) (Testing_Algorithm_for_the_Screening_and_Diagnosis_of_Hepatitis_C),if reactive,HCV Antibody Confirmation test (Diagnostic Procedure)
Positive HCV Antibody Confirmation in hemolyzed/cadaveric serum (Finding) (Testing_Algorithm_for_the_Screening_and_Diagnosis_of_Hepatitis_C),indicates,Active or past/resolved HCV infection (Disease or Syndrome)
Positive HCV Antibody Confirmation in hemolyzed/cadaveric serum (Finding) (Testing_Algorithm_for_the_Screening_and_Diagnosis_of_Hepatitis_C),requires,Nonhemolyzed HCV RNA test (Diagnostic Procedure) to distinguish active from past infection
Negative HCV Antibody Confirmation in hemolyzed/cadaveric serum (Finding) (Testing_Algorithm_for_the_Screening_and_Diagnosis_of_Hepatitis_C),indicates,False-reactive HCV antibody (Finding)
Negative screening result in hemolyzed/cadaveric serum (Finding) (Testing_Algorithm_for_the_Screening_and_Diagnosis_of_Hepatitis_C),indicates,No evidence of prior HCV exposure (Finding)
Initial thyroid evaluation (Procedure) (Thyroid_Function_Ordering_Algorithm),includes option,Thyroid Function Cascade (Diagnostic Procedure)
Initial thyroid evaluation (Procedure) (Thyroid_Function_Ordering_Algorithm),includes option,TSH measurement (Diagnostic Procedure)
TSH <0.1 mIU/L (Laboratory or Test Result) (Thyroid_Function_Ordering_Algorithm),suggests,Hyperthyroidism (Disease or Syndrome)
TSH <0.1 mIU/L (Laboratory or Test Result) (Thyroid_Function_Ordering_Algorithm),indicates test,Free T4 measurement (Diagnostic Procedure)
Normal Free T4 result (Laboratory or Test Result) (Thyroid_Function_Ordering_Algorithm),indicates test,Total T3 measurement (Diagnostic Procedure)
TSH 0.1-0.2 mIU/L (Laboratory or Test Result) (Thyroid_Function_Ordering_Algorithm),indicates test,Free T4 measurement (Diagnostic Procedure)
TSH 0.3-4.2 mIU/L (Laboratory or Test Result) (Thyroid_Function_Ordering_Algorithm),does not require,Additional thyroid tests (Diagnostic Procedure)
TSH >4.2 mIU/L (Laboratory or Test Result) (Thyroid_Function_Ordering_Algorithm),suggests,Hypothyroidism (Disease or Syndrome)
TSH >4.2 mIU/L (Laboratory or Test Result) (Thyroid_Function_Ordering_Algorithm),indicates test,Free T4 measurement (Diagnostic Procedure)
TSH >4.2 mIU/L (Laboratory or Test Result) (Thyroid_Function_Ordering_Algorithm),indicates test,Thyroid peroxidase antibodies measurement (Diagnostic Procedure)
Elevated C16 +/- C18:1 acylcarnitines (Finding) (Newborn-Screen-Elevated-C16-C18-Acylcarnitine),prompts performance of,"Plasma ammonia, blood gas, glucose, electrolytes, lactate, creatinine, kidney, liver function tests, urinalysis, thyroid function tests, and quantitative acylcarnitine analyses (Diagnostic Procedure)"
Elevated C16 +/- C18:1 acylcarnitines (Finding) (Newborn-Screen-Elevated-C16-C18-Acylcarnitine),suggests possibility of,Carnitine palmitoyltransferase 2 deficiency (Disease or Syndrome)
Elevated C16 +/- C18:1 acylcarnitines (Finding) (Newborn-Screen-Elevated-C16-C18-Acylcarnitine),suggests possibility of,Carnitine-acylcarnitine translocase deficiency (Disease or Syndrome)
Suspected CPT2 deficiency or CACT deficiency (Disease or Syndrome) (Newborn-Screen-Elevated-C16-C18-Acylcarnitine),prompts ordering of,"CGPH / Custom Gene Panel, Hereditary, Next-Generation Sequencing (Diagnostic Procedure)"
Normal results (Finding) (Newborn-Screen-Elevated-C16-C18-Acylcarnitine),prompts,No further interventions (Therapeutic or Preventive Procedure)
Elevated or normal free carnitine (C0) plus elevated C0/(C16+C18) ratio (Finding) (Newborn-Screen-Elevated-C0-C16-C18),Prompts,"Plasma ammonia, blood gas, glucose, electrolytes, liver function tests (Diagnostic Procedure)"
Elevated or normal free carnitine (C0) plus elevated C0/(C16+C18) ratio (Finding) (Newborn-Screen-Elevated-C0-C16-C18),Prompts,"Carnitine, Plasma or Serum (Diagnostic Procedure)"
Elevated or normal free carnitine (C0) plus elevated C0/(C16+C18) ratio (Finding) (Newborn-Screen-Elevated-C0-C16-C18),Prompts,"Acylcarnitines, Quantitative, Plasma or Serum (Diagnostic Procedure)"
Abnormal carnitine or acylcarnitine results (Finding) (Newborn-Screen-Elevated-C0-C16-C18),Suggests,Carnitine palmitoyl transferase 1 deficiency (Disease or Syndrome)
Carnitine palmitoyl transferase 1 deficiency (Disease or Syndrome) (Newborn-Screen-Elevated-C0-C16-C18),Indicates,Consider CGPH / Custom Gene Panel (Diagnostic Procedure)
Normal follow-up test results (Finding) (Newborn-Screen-Elevated-C0-C16-C18),Indicates,Stop (Therapeutic or Preventive Procedure)
Isolated elevation of propionylcarnitine (C3) (Finding) (Newborn-Screen-Follow-up-Elevated-C3-Isolated),prompts,Plasma ammonia measurement (Diagnostic Procedure)
Isolated elevation of propionylcarnitine (C3) (Finding) (Newborn-Screen-Follow-up-Elevated-C3-Isolated),prompts,Blood gas analysis (Diagnostic Procedure)
Isolated elevation of propionylcarnitine (C3) (Finding) (Newborn-Screen-Follow-up-Elevated-C3-Isolated),prompts,Glucose test (Diagnostic Procedure)
Isolated elevation of propionylcarnitine (C3) (Finding) (Newborn-Screen-Follow-up-Elevated-C3-Isolated),prompts,Electrolyte measurement (Diagnostic Procedure)
Isolated elevation of propionylcarnitine (C3) (Finding) (Newborn-Screen-Follow-up-Elevated-C3-Isolated),prompts,Complete blood cell count (Diagnostic Procedure)
Isolated elevation of propionylcarnitine (C3) (Finding) (Newborn-Screen-Follow-up-Elevated-C3-Isolated),prompts,Ketone urinalysis (Diagnostic Procedure)
Isolated elevation of propionylcarnitine (C3) (Finding) (Newborn-Screen-Follow-up-Elevated-C3-Isolated),prompts,"Organic acids screen, urine (Diagnostic Procedure)"
Isolated elevation of propionylcarnitine (C3) (Finding) (Newborn-Screen-Follow-up-Elevated-C3-Isolated),prompts,"Amino acids quantitation, plasma (Diagnostic Procedure)"
Isolated elevation of propionylcarnitine (C3) (Finding) (Newborn-Screen-Follow-up-Elevated-C3-Isolated),prompts,"Cobalamin, methionine, and methylmalonic acid pathways assay (Diagnostic Procedure)"
Isolated elevation of propionylcarnitine (C3) (Finding) (Newborn-Screen-Follow-up-Elevated-C3-Isolated),prompts,"Acylcarnitines quantitation, plasma (Diagnostic Procedure)"
Abnormal confirmatory tests (Finding) (Newborn-Screen-Follow-up-Elevated-C3-Isolated),consistent with,Methylmalonyl-CoA mutase deficiency (Disease)
Abnormal confirmatory tests (Finding) (Newborn-Screen-Follow-up-Elevated-C3-Isolated),consistent with,CblA or CblB deficiency (Disease)
Abnormal confirmatory tests (Finding) (Newborn-Screen-Follow-up-Elevated-C3-Isolated),consistent with,"CblC, CblD, CblF, CblJ, CblK, transcobalamin-II receptor, or vitamin B12 deficiency (Disease)"
Abnormal confirmatory tests (Finding) (Newborn-Screen-Follow-up-Elevated-C3-Isolated),consistent with,Propionyl-CoA carboxylase deficiency (Disease)
Abnormal confirmatory tests (Finding) (Newborn-Screen-Follow-up-Elevated-C3-Isolated),consistent with,Succinyl-CoA synthetase deficiency (Disease)
Normal confirmatory tests (Finding) (Newborn-Screen-Follow-up-Elevated-C3-Isolated),indicate,False positive newborn screen (Finding)
Normal confirmatory tests (Finding) (Newborn-Screen-Follow-up-Elevated-C3-Isolated),require,Rule out maternal vitamin B12 deficiency (Disease)
Suspected methylmalonic aciduria-propionic aciduria (Disease) (Newborn-Screen-Follow-up-Elevated-C3-Isolated),prompts,Methylmalonic aciduria-propionic aciduria combined gene panel (Diagnostic Procedure)
Chronic lymphocytic leukemia (Disease or Syndrome) (TP53_Mutation_Testing_Algorithm),requires,"P53CA / Hematologic Neoplasms, TP53 Somatic Mutation, DNA Sequencing (Diagnostic Procedure)"
Lymphoid or hematologic neoplasm other than CLL (Disease or Syndrome) (TP53_Mutation_Testing_Algorithm),requires,"P53CA / Hematologic Neoplasms, TP53 Somatic Mutation, DNA Sequencing (Diagnostic Procedure)"
Bone marrow or frozen tissue specimen (Tissue) (TP53_Mutation_Testing_Algorithm),undergoes,TP53 gene sequencing analysis without flow cytometry or B-cell enrichment (Diagnostic Procedure)
Peripheral blood specimen (Tissue) (TP53_Mutation_Testing_Algorithm),requires,"TP53 Gene Somatic Mutation Pre-Analysis, Cell Sorting (Diagnostic Procedure)"
Clonal B-cell population (Finding) (TP53_Mutation_Testing_Algorithm),prompts,B-cell enrichment prior to TP53 gene sequencing (Diagnostic Procedure)
Absence of clonal B-cell population (Finding) (TP53_Mutation_Testing_Algorithm),cancels,TP53 gene sequencing test (Diagnostic Procedure)
Nonhematologic malignancy (Disease or Syndrome) (TP53_Mutation_Testing_Algorithm),requires,"Genome Panel, Hereditary, Next-Generation Sequencing, Variants (Diagnostic Procedure)"
Suspected germline condition (Disease or Syndrome) (TP53_Mutation_Testing_Algorithm),requires,"Genome Panel, Hereditary, Next-Generation Sequencing, Variants (Diagnostic Procedure)"
Suspected Wilson Disease (Disease or Syndrome) (Wilson_Disease_Testing_Algorithm),indicates,Initial screening tests (Diagnostic Procedure)
Family members of Wilson Disease case (Population Group) (Wilson_Disease_Testing_Algorithm),require,Wilson Disease evaluation (Diagnostic Procedure)
Neurological or psychiatric symptoms ± liver disease (Finding) (Wilson_Disease_Testing_Algorithm),suggests,Wilson Disease evaluation (Diagnostic Procedure)
Unexplained liver disease (Finding) (Wilson_Disease_Testing_Algorithm),suggests,Wilson Disease evaluation (Diagnostic Procedure)
"Normal CP/serum Cu, normal 24-hour urine Cu, normal liver tests, absent K-F ring in age ≥15 (Finding) (Wilson_Disease_Testing_Algorithm)",excludes,Wilson Disease (Disease or Syndrome)
"Normal CP/serum Cu, normal 24-hour urine Cu, normal liver tests, absent K-F ring in age <15 (Finding) (Wilson_Disease_Testing_Algorithm)",requires,ATP7B Full Gene Sequencing (Diagnostic Procedure)
Negative ATP7B variants (Gene or Genome) (Wilson_Disease_Testing_Algorithm),requires,Continued follow-up (Clinical Procedure)
"Normal CP/serum Cu, increased 24-hour urine Cu, present K-F ring (Finding) (Wilson_Disease_Testing_Algorithm)",requires,ATP7B Full Gene Sequencing (Diagnostic Procedure)
Disease-causing ATP7B variants (Gene or Genome) (Wilson_Disease_Testing_Algorithm),confirms,Wilson Disease (Disease or Syndrome)
Two disease-causing ATP7B variants plus consistent histology (Finding) (Wilson_Disease_Testing_Algorithm),confirms,Wilson Disease (Disease or Syndrome)
Absence of ATP7B variants with copper >250 mcg/g and consistent histology (Finding) (Wilson_Disease_Testing_Algorithm),confirms,Wilson Disease (Disease or Syndrome)
Wilson Disease (Disease or Syndrome) (Wilson_Disease_Testing_Algorithm),requires,Pharmacologic treatment (Pharmacologic Substance)
Wilson Disease (Disease or Syndrome) (Wilson_Disease_Testing_Algorithm),requires,Family screening (Diagnostic Procedure)
"Decreased CP/serum Cu, increased 24-hour urine Cu, absent K-F ring (Finding) (Wilson_Disease_Testing_Algorithm)",requires,ATP7B Full Gene Sequencing (Diagnostic Procedure)
Negative ATP7B variants with copper <250 mcg/g and inconsistent histology (Finding) (Wilson_Disease_Testing_Algorithm),requires,Evaluation for alternative diagnosis (Diagnostic Procedure)
"Decreased CP/serum Cu, increased 24-hour urine Cu, present K-F ring (Finding) (Wilson_Disease_Testing_Algorithm)",confirms,Wilson Disease (Disease or Syndrome)
"Normal CP/serum Cu, normal 24-hour urine Cu, absent K-F ring (Finding) (Wilson_Disease_Testing_Algorithm)",requires,Evaluation for alternative diagnosis (Diagnostic Procedure)
Watery diarrhea (Finding) (Parasitic_Investigation_of_Stool_Specimens_Algorithm),indicates need for,Laboratory testing for Infectious Causes of Diarrhea (Diagnostic Procedure)
Travel to developing country (Finding) (Parasitic_Investigation_of_Stool_Specimens_Algorithm),indicates need for,Ova and Parasite exam (Diagnostic Procedure)
Travel history or immunocompromised status (Finding) (Parasitic_Investigation_of_Stool_Specimens_Algorithm),indicates need for,Strongyloides Antibody IgG test (Diagnostic Procedure)
Positive Strongyloides IgG result (Finding) (Parasitic_Investigation_of_Stool_Specimens_Algorithm),results in,No additional parasitologic testing (Procedure)
