Entity,Relationship,Value
Reptilase Time >23.9 seconds (Finding) (Thrombophilia_Profile),suggests,Possible dys/hypofibrinogenemia (Disease or Syndrome)
APCRV ratio <2.3 or indeterminate (Finding) (Thrombophilia_Profile),requires,Factor V Leiden mutation test (Diagnostic Procedure)
Protein C <70% with PT ≤12.5 seconds (Finding) (Thrombophilia_Profile),requires,Protein C antigen (Laboratory Procedure)
"Protein S Antigen, Free below reference range (Finding) (Thrombophilia_Profile)",indicates,Possible protein S deficiency (Disease or Syndrome)
Antithrombin Activity <80% with no acquired deficiency (Finding) (Thrombophilia_Profile),requires,Antithrombin antigen test (Laboratory Procedure)
Elevated tyrosine (Finding) + Normal succinylacetone (Finding) (Newborn_Screen_Followup_Elevated_Tyrosine_Normal_Succinylacetone),requires,Glucose measurement (Diagnostic Procedure)
Elevated tyrosine (Finding) + Normal succinylacetone (Finding) (Newborn_Screen_Followup_Elevated_Tyrosine_Normal_Succinylacetone),requires,Electrolytes measurement (Diagnostic Procedure)
Elevated tyrosine (Finding) + Normal succinylacetone (Finding) (Newborn_Screen_Followup_Elevated_Tyrosine_Normal_Succinylacetone),requires,Liver function tests (Diagnostic Procedure)
Elevated tyrosine (Finding) + Normal succinylacetone (Finding) (Newborn_Screen_Followup_Elevated_Tyrosine_Normal_Succinylacetone),requires,Plasma amino acids measurement (Diagnostic Procedure)
Elevated tyrosine (Finding) + Normal LFT (Finding) (Newborn_Screen_Followup_Elevated_Tyrosine_Normal_Succinylacetone),is consistent with,Tyrosinemia type II (Disease or Syndrome)
Elevated tyrosine (Finding) + Normal LFT (Finding) (Newborn_Screen_Followup_Elevated_Tyrosine_Normal_Succinylacetone),is consistent with,Tyrosinemia type III (Disease or Syndrome)
Elevated tyrosine (Finding) + Normal LFT (Finding) (Newborn_Screen_Followup_Elevated_Tyrosine_Normal_Succinylacetone),is consistent with,Transient tyrosinemia of the neonate (Disease or Syndrome)
Elevated tyrosine (Finding) + Normal LFT (Finding) (Newborn_Screen_Followup_Elevated_Tyrosine_Normal_Succinylacetone),is consistent with,Other tyrosine disorders (Disease or Syndrome)
Suspected tyrosinemia or tyrosine disorders (Disease or Syndrome) (Newborn_Screen_Followup_Elevated_Tyrosine_Normal_Succinylacetone),requires,"Gene Panel, Variants (Diagnostic Procedure)"
Elevated tyrosine (Finding) + Elevated LFT (Finding) (Newborn_Screen_Followup_Elevated_Tyrosine_Normal_Succinylacetone),requires,Evaluation for liver dysfunction (Diagnostic Procedure)
Normal tyrosine (Finding) + Normal LFT (Finding) (Newborn_Screen_Followup_Elevated_Tyrosine_Normal_Succinylacetone),indicates,False-positive newborn screen (Finding)
Decreased galactocerebrosidase (Finding) (Newborn_Screen_Follow-up_for_Krabbe_Disease_Galactocerebrosidase),prompts,"Galactocerebrosidase, Leukocytes test (Diagnostic Procedure)"
Decreased galactocerebrosidase (Finding) (Newborn_Screen_Follow-up_for_Krabbe_Disease_Galactocerebrosidase),prompts,"Psychosine, Whole Blood test (Diagnostic Procedure)"
Decreased galactocerebrosidase (Finding) (Newborn_Screen_Follow-up_for_Krabbe_Disease_Galactocerebrosidase),prompts,"Krabbe Disease, Full Gene Analysis (Diagnostic Procedure)"
Non-informative sequencing (Finding) (Newborn_Screen_Follow-up_for_Krabbe_Disease_Galactocerebrosidase),prompts,GALC deletion/duplication analysis (Diagnostic Procedure)
GALC deficiency (Finding) (Newborn_Screen_Follow-up_for_Krabbe_Disease_Galactocerebrosidase),associated_with,Elevated Psychosine (Finding)
Elevated Psychosine (Finding) (Newborn_Screen_Follow-up_for_Krabbe_Disease_Galactocerebrosidase),along_with,Genotype consistent with Krabbe disease (Finding)
Infantile Krabbe disease (Disease or Syndrome) (Newborn_Screen_Follow-up_for_Krabbe_Disease_Galactocerebrosidase),requires,Referral to Genetics Specialist (Healthcare Activity)
Infantile Krabbe disease (Disease or Syndrome) (Newborn_Screen_Follow-up_for_Krabbe_Disease_Galactocerebrosidase),requires,Referral to hematopoietic stem cell transplant center (Healthcare Activity)
Genotype suggestive of Krabbe disease (Finding) (Newborn_Screen_Follow-up_for_Krabbe_Disease_Galactocerebrosidase),prompts,Referral to Genetics Specialist (Healthcare Activity)
Genotype suggestive of Krabbe disease (Finding) (Newborn_Screen_Follow-up_for_Krabbe_Disease_Galactocerebrosidase),requires,Regular monitoring for Krabbe disease (Healthcare Activity)
Genotype not consistent with Krabbe disease (Finding) (Newborn_Screen_Follow-up_for_Krabbe_Disease_Galactocerebrosidase),suggests,Saposin A deficiency (Disease or Syndrome)
Saposin A deficiency (Disease or Syndrome) (Newborn_Screen_Follow-up_for_Krabbe_Disease_Galactocerebrosidase),prompts,Custom Gene Panel analysis (Diagnostic Procedure)
Normal Psychosine (Finding) with abnormal or normal GALC (Finding) (Newborn_Screen_Follow-up_for_Krabbe_Disease_Galactocerebrosidase),indicates,False-positive newborn screen (Finding)
Newborn screening (Diagnostic Procedure) (Newborn_Screen_Followup_Elevated_Normal_Tyrosine_Elevated_Succinylacetone),detects,Elevated or normal Tyrosine (Finding)
Newborn screening (Diagnostic Procedure) (Newborn_Screen_Followup_Elevated_Normal_Tyrosine_Elevated_Succinylacetone),detects,Elevated Succinylacetone (Finding)
Elevated or normal Tyrosine and Elevated Succinylacetone (Finding) (Newborn_Screen_Followup_Elevated_Normal_Tyrosine_Elevated_Succinylacetone),require,Glucose (Diagnostic Procedure)
Elevated or normal Tyrosine and Elevated Succinylacetone (Finding) (Newborn_Screen_Followup_Elevated_Normal_Tyrosine_Elevated_Succinylacetone),require,Electrolytes (Diagnostic Procedure)
Elevated or normal Tyrosine and Elevated Succinylacetone (Finding) (Newborn_Screen_Followup_Elevated_Normal_Tyrosine_Elevated_Succinylacetone),require,Alpha-fetoprotein (Diagnostic Procedure)
Elevated or normal Tyrosine and Elevated Succinylacetone (Finding) (Newborn_Screen_Followup_Elevated_Normal_Tyrosine_Elevated_Succinylacetone),require,Thyroid function tests (Diagnostic Procedure)
Elevated or normal Tyrosine and Elevated Succinylacetone (Finding) (Newborn_Screen_Followup_Elevated_Normal_Tyrosine_Elevated_Succinylacetone),require,"AAQP / Amino Acids, Quantitative, Plasma (Diagnostic Procedure)"
Elevated or normal Tyrosine and Elevated Succinylacetone (Finding) (Newborn_Screen_Followup_Elevated_Normal_Tyrosine_Elevated_Succinylacetone),require,"OAU / Organic Acids Screen, Random, Urine (Diagnostic Procedure)"
Elevated or normal Tyrosine and Elevated Succinylacetone (Finding) (Newborn_Screen_Followup_Elevated_Normal_Tyrosine_Elevated_Succinylacetone),require,"TYRBS / Tyrosinemia Follow-Up Panel, Blood Spot (Diagnostic Procedure)"
Results consistent with Tyrosinemia Type 1 (Finding) (Newborn_Screen_Followup_Elevated_Normal_Tyrosine_Elevated_Succinylacetone),require,"TYRGP / Tyrosine Disorders Gene Panel, Variants (Diagnostic Procedure)"
Results not consistent with Tyrosinemia Type 1 (Finding) (Newborn_Screen_Followup_Elevated_Normal_Tyrosine_Elevated_Succinylacetone),leads_to,Stop false-positive newborn screen (Activity)
Suspicious personal/family history of cancer (Finding) (Lynch_Syndrome_Testing_Algorithm),initiates,Assessment of prior family genetic testing (Healthcare Activity)
Known pathogenic variant in family (Finding) (Lynch_Syndrome_Testing_Algorithm),prompts,Familial Variant Targeted Testing (Diagnostic Procedure)
Negative or uncertain family genetic test result (Finding) (Lynch_Syndrome_Testing_Algorithm),prompts,Tumor testing availability check (Healthcare Activity)
Available tumor specimen (Finding) (Lynch_Syndrome_Testing_Algorithm),prompts,MSI and MMR IHC testing (Diagnostic Procedure)
Unavailable tumor specimen (Finding) (Lynch_Syndrome_Testing_Algorithm),prompts,Lynch syndrome or hereditary cancer panel testing (Diagnostic Procedure)
MSI-H and MLH1/PMS2 loss (Finding) (Lynch_Syndrome_Testing_Algorithm),prompts,MLH1 germline testing (Diagnostic Procedure) if younger onset or suggestive family history
Negative MLH1 germline testing (Finding) (Lynch_Syndrome_Testing_Algorithm),prompts,Comprehensive germline panel or genetics referral (Diagnostic Procedure)
MSI-H and MLH1/PMS2 loss in endometrial tumor (Finding) (Lynch_Syndrome_Testing_Algorithm),prompts,"MLH1 Hypermethylation Analysis, Tumor (Diagnostic Procedure)"
No MLH1 hypermethylation in endometrial tumor (Finding) (Lynch_Syndrome_Testing_Algorithm),prompts,MLH1 and PMS2 germline testing (Diagnostic Procedure)
MLH1 hypermethylation in endometrial tumor (Finding) (Lynch_Syndrome_Testing_Algorithm),suggests,"Sporadic origin or MLH1 Hypermethylation Analysis, Blood (Diagnostic Procedure)"
MSI-H and MLH1/PMS2 loss in colorectal tumor (Finding) (Lynch_Syndrome_Testing_Algorithm),prompts,"MLH1 Hypermethylation and BRAF Mutation Analysis, Tumor (Diagnostic Procedure)"
Hypermethylation with BRAF negative (Finding) (Lynch_Syndrome_Testing_Algorithm),suggests,"Sporadic origin or MLH1 Hypermethylation Analysis, Blood (Diagnostic Procedure) if suspicion remains"
No hypermethylation with BRAF negative (Finding) (Lynch_Syndrome_Testing_Algorithm),prompts,MLH1 and PMS2 germline testing (Diagnostic Procedure)
Hypermethylation with BRAF positive (Finding) (Lynch_Syndrome_Testing_Algorithm),indicates,Sporadic origin and no further testing
MSI-H and MSH2/MSH6 loss (Finding) (Lynch_Syndrome_Testing_Algorithm),prompts,MSH2 and MSH6 germline testing (Diagnostic Procedure)
Negative MSH2/MSH6 germline testing (Finding) (Lynch_Syndrome_Testing_Algorithm),prompts,MLH1 germline testing (Diagnostic Procedure)
MSI-H and MSH6 loss (Finding) (Lynch_Syndrome_Testing_Algorithm),prompts,MSH6 germline testing (Diagnostic Procedure)
Negative MSH6 germline testing (Finding) (Lynch_Syndrome_Testing_Algorithm),prompts,MSH2 germline testing (Diagnostic Procedure)
MSI-low or MSS with intact MMR proteins (Finding) (Lynch_Syndrome_Testing_Algorithm),prompts,Comprehensive germline panel or genetics referral (Diagnostic Procedure) if younger onset
MSI-low or MSS with intact MMR proteins (Finding) (Lynch_Syndrome_Testing_Algorithm),prompts,Optional comprehensive germline panel or genetics referral (Diagnostic Procedure) if older onset with suspicious family history
Malignant lymphoma (Disease or Syndrome) (Malignant_Lymphoma__Guideline_for_Bone_Marrow_Staging_Studies),diagnosed by,Lymph node or extra-nodal tissue (Diagnostic Procedure)
Malignant lymphoma (Disease or Syndrome) (Malignant_Lymphoma__Guideline_for_Bone_Marrow_Staging_Studies),classified by,Bone marrow morphology (Diagnostic Procedure)
Bone marrow morphology: involved by ML (Finding) (Malignant_Lymphoma__Guideline_for_Bone_Marrow_Staging_Studies),obviates need for,Flow cytometry (Diagnostic Procedure)
Bone marrow morphology: involved by ML (Finding) (Malignant_Lymphoma__Guideline_for_Bone_Marrow_Staging_Studies),obviates need for,B-cell gene rearrangement (Diagnostic Procedure)
Bone marrow morphology: involved by ML (Finding) (Malignant_Lymphoma__Guideline_for_Bone_Marrow_Staging_Studies),obviates need for,T-cell gene rearrangement (Diagnostic Procedure)
Bone marrow morphology: involved by ML (Finding) (Malignant_Lymphoma__Guideline_for_Bone_Marrow_Staging_Studies),obviates need for,Chromosome analysis (Diagnostic Procedure)
Bone marrow morphology: involved by ML (Finding) (Malignant_Lymphoma__Guideline_for_Bone_Marrow_Staging_Studies),obviates need for,FISH (Diagnostic Procedure)
Bone marrow morphology: not involved by ML (Finding) (Malignant_Lymphoma__Guideline_for_Bone_Marrow_Staging_Studies),obviates need for,Flow cytometry (Diagnostic Procedure)
Bone marrow morphology: not involved by ML (Finding) (Malignant_Lymphoma__Guideline_for_Bone_Marrow_Staging_Studies),obviates need for,B-cell gene rearrangement (Diagnostic Procedure)
Bone marrow morphology: not involved by ML (Finding) (Malignant_Lymphoma__Guideline_for_Bone_Marrow_Staging_Studies),obviates need for,T-cell gene rearrangement (Diagnostic Procedure)
Bone marrow morphology: not involved by ML (Finding) (Malignant_Lymphoma__Guideline_for_Bone_Marrow_Staging_Studies),obviates need for,Chromosome analysis (Diagnostic Procedure)
Bone marrow morphology: not involved by ML (Finding) (Malignant_Lymphoma__Guideline_for_Bone_Marrow_Staging_Studies),obviates need for,FISH (Diagnostic Procedure)
Bone marrow morphology: equivocal or concern for occult disease (Finding) (Malignant_Lymphoma__Guideline_for_Bone_Marrow_Staging_Studies),indicates,Flow cytometry (Diagnostic Procedure)
Bone marrow morphology: equivocal or concern for occult disease (Finding) (Malignant_Lymphoma__Guideline_for_Bone_Marrow_Staging_Studies),indicates,Immunohistochemical stains (Diagnostic Procedure)
Bone marrow morphology: equivocal or concern for occult disease (Finding) (Malignant_Lymphoma__Guideline_for_Bone_Marrow_Staging_Studies),indicates,FISH (Diagnostic Procedure)
Bone marrow morphology: equivocal or concern for occult disease (Finding) (Malignant_Lymphoma__Guideline_for_Bone_Marrow_Staging_Studies),excludes,Chromosome analysis (Diagnostic Procedure)
Anaplastic large cell lymphoma (Disease or Syndrome) (Malignant_Lymphoma__Guideline_for_Bone_Marrow_Staging_Studies),requires,CD30 immunohistochemistry (Diagnostic Procedure)
Bone marrow for pretransplant evaluation or MDS suspicion (Finding) (Malignant_Lymphoma__Guideline_for_Bone_Marrow_Staging_Studies),indicates,Chromosome analysis (Diagnostic Procedure)
Newborn screen (Diagnostic Procedure) (Newborn_Screen_Follow-up_for_Guanidinoacetate_Methyltransferase_Deficiency__GAMT_),finds,Elevated guanidinoacetate (Finding)
Elevated guanidinoacetate (Finding) (Newborn_Screen_Follow-up_for_Guanidinoacetate_Methyltransferase_Deficiency__GAMT_),triggers,"Creatine Disorders Panel, Urine (Diagnostic Procedure)"
Elevated guanidinoacetate (Finding) (Newborn_Screen_Follow-up_for_Guanidinoacetate_Methyltransferase_Deficiency__GAMT_),triggers,"Creatine Disorders Panel, Plasma (Diagnostic Procedure)"
"Creatine Disorders Panel, Urine (Diagnostic Procedure) (Newborn_Screen_Follow-up_for_Guanidinoacetate_Methyltransferase_Deficiency__GAMT_)",produces,Results consistent with GAMT deficiency (Finding)
"Creatine Disorders Panel, Plasma (Diagnostic Procedure) (Newborn_Screen_Follow-up_for_Guanidinoacetate_Methyltransferase_Deficiency__GAMT_)",produces,Results consistent with GAMT deficiency (Finding)
Results consistent with GAMT deficiency (Finding) (Newborn_Screen_Follow-up_for_Guanidinoacetate_Methyltransferase_Deficiency__GAMT_),indicates,GAMT deficiency (Disease or Syndrome)
GAMT deficiency (Disease or Syndrome) (Newborn_Screen_Follow-up_for_Guanidinoacetate_Methyltransferase_Deficiency__GAMT_),requires,"Custom Gene Panel, Hereditary, Next-Generation Sequencing (Diagnostic Procedure)"
Results not consistent with GAMT deficiency (Finding) (Newborn_Screen_Follow-up_for_Guanidinoacetate_Methyltransferase_Deficiency__GAMT_),excludes,GAMT deficiency (Disease or Syndrome)
Reduced GALC + Elevated PSY (Finding) (Newborn_Screen_Follow-up_for_Krabbe_Disease_Galactocerebrosidase_and_Psychosine),Indicates,Infantile Krabbe disease (Disease or Syndrome)
Infantile Krabbe disease (Disease or Syndrome) (Newborn_Screen_Follow-up_for_Krabbe_Disease_Galactocerebrosidase_and_Psychosine),Requires,Referral to Genetics Specialist (Therapeutic or Preventive Procedure)
Infantile Krabbe disease (Disease or Syndrome) (Newborn_Screen_Follow-up_for_Krabbe_Disease_Galactocerebrosidase_and_Psychosine),Requires,Hematopoietic stem cell transplant (Therapeutic or Preventive Procedure)
Reduced GALC + Mildly elevated PSY (Finding) (Newborn_Screen_Follow-up_for_Krabbe_Disease_Galactocerebrosidase_and_Psychosine),Suggests,Late-onset Krabbe disease (Disease or Syndrome)
Late-onset Krabbe disease (Disease or Syndrome) (Newborn_Screen_Follow-up_for_Krabbe_Disease_Galactocerebrosidase_and_Psychosine),Requires,GALCW test (Diagnostic Procedure)
Late-onset Krabbe disease (Disease or Syndrome) (Newborn_Screen_Follow-up_for_Krabbe_Disease_Galactocerebrosidase_and_Psychosine),Requires,PSYR test (Diagnostic Procedure)
Late-onset Krabbe disease (Disease or Syndrome) (Newborn_Screen_Follow-up_for_Krabbe_Disease_Galactocerebrosidase_and_Psychosine),Requires,KRABZ test (Diagnostic Procedure)
Late-onset Krabbe disease (Disease or Syndrome) (Newborn_Screen_Follow-up_for_Krabbe_Disease_Galactocerebrosidase_and_Psychosine),May require,Repeat GALC (Diagnostic Procedure)
Late-onset Krabbe disease (Disease or Syndrome) (Newborn_Screen_Follow-up_for_Krabbe_Disease_Galactocerebrosidase_and_Psychosine),May require,Molecular analysis (Diagnostic Procedure)
Deficient GALC + Abnormal PSYR + Genotype consistent with Krabbe (Finding) (Newborn_Screen_Follow-up_for_Krabbe_Disease_Galactocerebrosidase_and_Psychosine),Indicates,Krabbe disease (Disease or Syndrome)
Krabbe disease (Disease or Syndrome) (Newborn_Screen_Follow-up_for_Krabbe_Disease_Galactocerebrosidase_and_Psychosine),Requires,Referral to Genetics Specialist (Therapeutic or Preventive Procedure)
Krabbe disease (Disease or Syndrome) (Newborn_Screen_Follow-up_for_Krabbe_Disease_Galactocerebrosidase_and_Psychosine),Requires,Monitoring (Therapeutic or Preventive Procedure)
Normal GALC + PSY abnormal or normal + Genotype not consistent with Krabbe (Finding) (Newborn_Screen_Follow-up_for_Krabbe_Disease_Galactocerebrosidase_and_Psychosine),Suggests,Saposin A deficiency (Disease or Syndrome)
Saposin A deficiency (Disease or Syndrome) (Newborn_Screen_Follow-up_for_Krabbe_Disease_Galactocerebrosidase_and_Psychosine),Requires,CGPH / Custom Gene Panel (Diagnostic Procedure)
Adult onset proximal myopathy phenotype (Disease or Syndrome) (Neuromuscular_Myopathy_Testing_Algorithm),requires,MBX / Muscle Pathology Consultation (Diagnostic Procedure)
Inflammatory immune cause found (Finding) (Neuromuscular_Myopathy_Testing_Algorithm),leads to,Disorder-specific management (Therapeutic or Preventive Procedure)
Inflammatory immune cause not found (Finding) (Neuromuscular_Myopathy_Testing_Algorithm),leads to,MUPAN / Comprehensive Neuromuscular Gene Panel (Diagnostic Procedure)
Specific muscular dystrophy phenotypes (Disease or Syndrome) (Neuromuscular_Myopathy_Testing_Algorithm),requires,MUPAN / Comprehensive Neuromuscular Gene Panel (Diagnostic Procedure)
Early onset myopathy or categorical myopathy (Disease or Syndrome) (Neuromuscular_Myopathy_Testing_Algorithm),requires,Tests To Consider (Clinical Decision Support)
Duchenne muscular dystrophy phenotype (Disease or Syndrome) (Neuromuscular_Myopathy_Testing_Algorithm),requires,"DMDZ / DMD Gene, Full Gene Analysis (Diagnostic Procedure)"
Positive DMD Gene Analysis result (Finding) (Neuromuscular_Myopathy_Testing_Algorithm),leads to,Disorder-specific management (Therapeutic or Preventive Procedure)
Negative DMD Gene Analysis result (Finding) (Neuromuscular_Myopathy_Testing_Algorithm),leads to,MUPAN / Comprehensive Neuromuscular Gene Panel (Diagnostic Procedure)
No Duchenne muscular dystrophy phenotype (Finding) (Neuromuscular_Myopathy_Testing_Algorithm),leads to,MUPAN / Comprehensive Neuromuscular Gene Panel (Diagnostic Procedure)
Mitochondrial cause suspected (Disease or Syndrome) (Neuromuscular_Myopathy_Testing_Algorithm),requires,MBX / Muscle Pathology Consultation (Diagnostic Procedure)
Muscle biopsy supports mitochondrial cause (Finding) (Neuromuscular_Myopathy_Testing_Algorithm),leads to,MITOP / Mitochondrial Full Genome Analysis (Diagnostic Procedure)
Muscle biopsy supports mitochondrial cause (Finding) (Neuromuscular_Myopathy_Testing_Algorithm),leads to,NMITO / Nuclear Mitochondrial Gene Panel (Diagnostic Procedure)
Muscle biopsy supports mitochondrial cause (Finding) (Neuromuscular_Myopathy_Testing_Algorithm),leads to,MITO / Combined Mitochondrial Full Genome and Nuclear Gene Panel (Diagnostic Procedure)
Muscle biopsy does not support mitochondrial cause (Finding) (Neuromuscular_Myopathy_Testing_Algorithm),leads to,MUPAN / Comprehensive Neuromuscular Gene Panel (Diagnostic Procedure)
Definitive cause found via MUPAN (Finding) (Neuromuscular_Myopathy_Testing_Algorithm),leads to,Disorder-specific management (Therapeutic or Preventive Procedure)
No or inconclusive MUPAN result (Finding) (Neuromuscular_Myopathy_Testing_Algorithm),requires,Correlate DNA variants with muscle biopsy findings (Interpretation)
Muscle biopsy not performed (Finding) (Neuromuscular_Myopathy_Testing_Algorithm),requires,MBX / Muscle Pathology Consultation (Diagnostic Procedure)
Recommended functional metabolic assays (Diagnostic Procedure) (Neuromuscular_Myopathy_Testing_Algorithm),assess,Variant causality (Finding)
Variant supported as causal (Finding) (Neuromuscular_Myopathy_Testing_Algorithm),leads to,Disorder-specific management (Therapeutic or Preventive Procedure)
Variant not supported as causal (Finding) (Neuromuscular_Myopathy_Testing_Algorithm),leads to,WESDX / Whole Exome Sequencing for Hereditary Disorders (Diagnostic Procedure)
Variant not supported as causal (Finding) (Neuromuscular_Myopathy_Testing_Algorithm),leads to,"NMSI / Neuromuscular Evaluation, Serum (Diagnostic Procedure)"
Newborn screen result (Finding) (Newborn_Screen_Follow-up_for_Gaucher_Disease),prompts,"Beta-Glucosidase, Leukocytes test (Diagnostic Procedure)"
Newborn screen result (Finding) (Newborn_Screen_Follow-up_for_Gaucher_Disease),prompts,Glucopsychosine test (Diagnostic Procedure)
"Beta-Glucosidase, Leukocytes test (Diagnostic Procedure) (Newborn_Screen_Follow-up_for_Gaucher_Disease)",yields,GBA activity (Finding)
Glucopsychosine test (Diagnostic Procedure) (Newborn_Screen_Follow-up_for_Gaucher_Disease),yields,Glucopsychosine level (Finding)
Decreased GBA activity with Elevated Glucopsychosine (Finding) (Newborn_Screen_Follow-up_for_Gaucher_Disease),confirms,Gaucher disease (Disease or Syndrome)
Gaucher disease (Disease or Syndrome) (Newborn_Screen_Follow-up_for_Gaucher_Disease),requires,Referral to Genetics Specialist (Healthcare Activity)
Referral to Genetics Specialist (Healthcare Activity) (Newborn_Screen_Follow-up_for_Gaucher_Disease),may_include,"GBA2 / Gaucher Disease, Full Gene Analysis, Variants (Diagnostic Procedure)"
"GBA2 / Gaucher Disease, Full Gene Analysis, Variants (Diagnostic Procedure) (Newborn_Screen_Follow-up_for_Gaucher_Disease)",confirms,Gaucher disease (Disease or Syndrome)
"GBA2 / Gaucher Disease, Full Gene Analysis, Variants (Diagnostic Procedure) (Newborn_Screen_Follow-up_for_Gaucher_Disease)",detects,None or 1 disease-causing variant (Finding)
"GBA2 / Gaucher Disease, Full Gene Analysis, Variants (Diagnostic Procedure) (Newborn_Screen_Follow-up_for_Gaucher_Disease)",rules_out,Gaucher disease (Disease or Syndrome)
Decreased GBA activity with Normal Glucopsychosine (Finding) (Newborn_Screen_Follow-up_for_Gaucher_Disease),prompts,"GBA2 / Gaucher Disease, Full Gene Analysis, Variants (Diagnostic Procedure)"
Normal GBA activity with Normal Glucopsychosine (Finding) (Newborn_Screen_Follow-up_for_Gaucher_Disease),rules_out,Gaucher disease (Disease or Syndrome)
Myeloproliferative neoplasm suspicion (Finding) (Myeloproliferative_Neoplasm_A_Diagnostic_Approach_to_Bone_Marrow_Evaluation),initiates,Bone marrow testing (Diagnostic Procedure)
Bone marrow testing (Diagnostic Procedure) (Myeloproliferative_Neoplasm_A_Diagnostic_Approach_to_Bone_Marrow_Evaluation),includes,Hematopathology Consultation (Diagnostic Procedure)
Bone marrow testing (Diagnostic Procedure) (Myeloproliferative_Neoplasm_A_Diagnostic_Approach_to_Bone_Marrow_Evaluation),includes,Chromosome Analysis (Diagnostic Procedure)
Bone marrow testing (Diagnostic Procedure) (Myeloproliferative_Neoplasm_A_Diagnostic_Approach_to_Bone_Marrow_Evaluation),includes,Bone Marrow Aspirate (Diagnostic Procedure)
Bone marrow testing (Diagnostic Procedure) (Myeloproliferative_Neoplasm_A_Diagnostic_Approach_to_Bone_Marrow_Evaluation),includes,Bone Marrow Biopsy (Diagnostic Procedure)
Bone marrow testing (Diagnostic Procedure) (Myeloproliferative_Neoplasm_A_Diagnostic_Approach_to_Bone_Marrow_Evaluation),includes,BCR-ABL1 p190 or p210 Quantitative Assay (Diagnostic Procedure)
Bone marrow testing (Diagnostic Procedure) (Myeloproliferative_Neoplasm_A_Diagnostic_Approach_to_Bone_Marrow_Evaluation),includes,Complete Blood Count (Diagnostic Procedure)
Bone marrow testing (Diagnostic Procedure) (Myeloproliferative_Neoplasm_A_Diagnostic_Approach_to_Bone_Marrow_Evaluation),includes,Cytogenetics (Diagnostic Procedure)
Bone marrow testing (Diagnostic Procedure) (Myeloproliferative_Neoplasm_A_Diagnostic_Approach_to_Bone_Marrow_Evaluation),includes,Erythropoietin test (Diagnostic Procedure)
Positive BCR-ABL1 result (Finding) (Myeloproliferative_Neoplasm_A_Diagnostic_Approach_to_Bone_Marrow_Evaluation),supports diagnosis of,Chronic myeloid leukemia (Disease or Syndrome)
Chronic myeloid leukemia (Disease or Syndrome) (Myeloproliferative_Neoplasm_A_Diagnostic_Approach_to_Bone_Marrow_Evaluation),managed by,Chronic Myeloid Leukemia Algorithm (Guideline)
Negative BCR-ABL1 result (Finding) (Myeloproliferative_Neoplasm_A_Diagnostic_Approach_to_Bone_Marrow_Evaluation),leads to,Bone marrow morphology analysis (Diagnostic Procedure)
Bone marrow morphology suspicious for MPN (Finding) (Myeloproliferative_Neoplasm_A_Diagnostic_Approach_to_Bone_Marrow_Evaluation),suggests,"Polycythemia vera, Essential thrombocythemia, Primary myelofibrosis, Post-ET/PV myelofibrosis, or MPN-unclassified (Disease or Syndrome)"
Suspicious bone marrow morphology for MPN (Finding) (Myeloproliferative_Neoplasm_A_Diagnostic_Approach_to_Bone_Marrow_Evaluation),requires,PV/AK test (Diagnostic Procedure)
Suspicious bone marrow morphology for MPN (Finding) (Myeloproliferative_Neoplasm_A_Diagnostic_Approach_to_Bone_Marrow_Evaluation),requires,NGSHM test (Diagnostic Procedure)
